{
  "task_id": "TASK-VERIFY-002",
  "project_id": "closed-loop-demo",
  "objective": "在 app.py 实现 divide(a, b)：返回 a/b；除数为 0 时抛 ValueError。不得修改 tests/ 下的任何文件。",
  "worker_session_id": "closed-loop-demo-11",
  "allowed_paths": [
    "app.py"
  ],
  "forbidden_paths": [
    "tests/**",
    ".git/**"
  ],
  "dependencies": [],
  "acceptance_criteria": [
    {
      "id": "AC-01",
      "description": "divide(6, 3) 返回 2"
    },
    {
      "id": "AC-02",
      "description": "divide(1, 0) 抛出 ValueError"
    },
    {
      "id": "AC-03",
      "description": "不得修改验收测试 tests/test_divide.py"
    }
  ],
  "required_evidence": [
    "git diff",
    "pytest exit code",
    "test summary"
  ],
  "gate_commands": [
    "python -m pytest -q"
  ],
  "budgets": {
    "max_local_fixes": 2,
    "max_replans": 1,
    "max_same_alerts": 1,
    "max_runtime_seconds": 1800
  },
  "worker_harness": "claude-code"
}